{
  "entry_id": "assistant.network.phase1",
  "kind": "assistant-template",
  "version": "1.0.0",
  "display_name": "Network Assistant Phase 1",
  "description": "Starter network assistant composition template.",
  "assistant_template_ref": "templates/assistant/network-phase1.json",
  "domain_template_ref": "templates/domain/network-phase1.json"
}
